"Maybe he did cheat on you, but is he truly sorry and willing to try to change?"
Maybe he dresses better around you or is wearing some kind of cologne.
Maybe it's also time to look at yourself.
"Maybe on the first few dates, he'll mention fights he's been in."
Maybe you need a secret weapon Maybe you need to know how to be irresistible to men.
"Men that are ready for violence might seem sexy and forbidden, but they also come with all kinds of other problems."
Men use sex as one of their very few outlets to release stress and gain some kind of renewal.
Men who have problems like these will run away all your friends and keep tabs on where you are and who you're talking to.
Mention something you are going to do soon and excitedly tell him he'd love doing it as well.
Most guys have their style whether its t-shirts and jeans or button down shirts and slacks.
Most people that have freed themselves from cheating relationships look back with disgust that they could have been so stupid about the whole thing.
"Most women ask, Is my man cheating on me as a result of how little they see of their boyfriends or husbands any more."
My favourite of the great first date tips is to take care of everything you can before the first date.
My husband is in an emotional affair.
My question is this: Wouldn't it is better to just be the girl that everyone wants to ask out?
"No matter if you stay in this relationship or not, one thing is certain: the better you are as a complete person, the better relationships will be."
"No one should have to go through something like this alone, but we all do."
"Now some guys get that scary wake-up call from their doctors and decide that their health is an important goal, but if he starts working out for no apparent reason, he might be interested in looking good in this leopard print banana hammocks!"
Now we just need to get a guy to ask you out.
Now you know that a jerk doesn't like you and you've saved all the time looking for signs he is into you.
"Obviously, the appearance of health, beauty, and good genetics is near the top of everyone list, but what does that mean?"
"Obviously, this is situation dependent."
"Of course, a lot of these traits are generalizations."
"Of course, being an awesome girlfriend or wife still doesn't change the fact that something isn't right."
Often a cheater will accuse you of cheating too.
"On one hand, he's seeking closeness with another woman."
"On the other, it didn't reach the level of a full blown affair."
"Once again, a brilliant book has been written on this subject."
"Once they see that they did it and got away with it, they'll think you might know something that they just discovered."
"Once you believe you've got the goods, you already know how to attract a man."
"Once you do it and get away with it, it gives you a kind of invincible feeling."
"Once you have figured out your situation, now its time to put him on a quest and start working on your life."
"Once you read this article, some things might jump right out at you."
"Once you really understand how great you are, problems like jealousy in relationships magically disappear because you'll no longer attract small-minded men any more!"
"One day, you might get sick of his jealousy and leave him."
One of our favourites is a great audio course teaching you how to get your confidence back.
One of the best first date secrets is to be prepared.
One of the sure-fire signs of infidelity is that she's never around any more.
One warning though: all of these signs of infidelity should be compared to his previous actions and behaviour.
One way to look at this so its not so scary is to consider working small aspects of all of this great information into your life every week.
"Only stop to ask him questions about what he's telling you like, how did that make you feel?"
Or maybe he comes home and heads straight for the shower.
Or maybe there are things that he keeps hidden because he feels you will judge him in one way or another.
Our goal here is to identify cheating men before you fall in love with him.
Overly forward guys are big warning signs on how to spot a cheater and avoid him.
Pay attention here: they get complimented their whole lives.
Pay attention to the things you find impressive about him.
Pay attention to what he says especially if it's delivered jokingly.
Pay attention to what this guy might really be saying.
People get comfortable and stop trying to captivate their loved ones.
People go all throughout their lives regretting missed connections.
People throw themselves at a beautiful persons feet begging to be trampled.
Please note: Doing a daily underwear check is kinda freaky and will drive you crazy so only do this one as a last resort.
Plus he can keep tabs on you to keep you out of trouble.
Plus you get the intensity of making up after a big fight.
"Question submitted by Trina, 29, Victoria, British Columbia"
"Question Submitted by, Confused from California"
"Rebook, Catch a Cheat gives you all the ways to know for sure what your man is up to."
Recovering from an emotional affair and making your relationship as strong as it was takes three things.
Regret is one of the worst emotions
Remember to compare his current actions with the way he used to act.
Running around your house pulling down your panties drying on the lampshades or the stack of pizza boxes next to the front door makes you look like a jerk.
Saying things like You're so brilliant should always be followed with the reason.
Seeking the interactions we can't get from the one we love happens all the time.
Seems ridiculous now that there are several billion people on earth Guys still deal with this very real fear.
"Seriously, be quiet and let him carry the conversation for a while."
She didn't pop out of her mother and immediately start in with an anecdote about the cute guy who helped her find her pinky.
She has all the great qualities that know just how to attract a man.
She walks into the room and steals everyone breath by the sheer force of her presence.
She wasn't born charming!
"She's funny, smart, kind, and personable."
Should You Stay or Should You Go asks all the questions you need to consider when thinking about leaving a shaky relationship.
Should You Stay or Should You Go is a lifesaver!
"Since you are the only one that can help this relationship, you need to be a bit more active in initiating sex."
Sit there in silence for a while and see how he continues the conversation.
"Slow down, sister!"
"Snooping is a really bad thing, and this one is pretty creepy, but when you really need to know, this might be your last bit of information."
So is he a cheater?
"So maybe this doesn't happen to you, but it doesn't have to for you to understand what's really happening here."
So now he finds himself making tons of excuses as to why he has to leave or will be home very late or even go away on a job related trip.
So now he finds himself making tons of excuses as to why he has to leave or will be home very late or even go away on a job related trip.
"So when you look away and then look back, its very crucial to smile a little and flash your eyes."
So where are you with this whole situation?
"So while you are gazing at him in a reasonably private situation, how does he react?"
So you should be prepared for any possibility.
"So you've made yourself smooth and sexy, made your car spotless, maybe even re-wallpapered you're living room now let it go."
"Some dudes are just jealous, but when one accuses you of infidelity for no reason, be wary."
Some dudes feel so guilty about cheating on you that they will be afraid to touch you.
"Some dudes will get so invigorated by some side action, that he will bring his new found knowledge into your bedroom."
Some guys are just hard to get a hold of.
"Some guys are way more subtle, but there is an inescapable urge to try to impress the girl he's got the hots for that drives men to incredible (and often embarrassing) excess."
Some guys hate it when their girlfriends try to assert themselves.
Some guys just can't be trusted.
Some guys swing in the other direction and become hyper-sexual.
"Some of it might not be so obvious, like how to be rich, but think about it this way: are you looking for a dude that can't pay his own bills?"
Some people just can't shut up on first dates.
Some people think its fine as long as there is no sex.
Some people think its worse than a sexual affair because the emotional connection he builds with another woman could lead to LOVE.
Some people think that any cheating is cheating.
"Some say, Once a cheater, always a cheater."
Some things will be more difficult to pinpoint.
Somehow he has been forced to spend late hour at the office or gets called away inconveniently or unexpectedly.
Somehow he has been forced to spend late hours at the office or gets called away inconveniently or unexpectedly.
Someone was handing them out on the street Yeah right!
Sometimes its easier to just act like nothing is wrong.
Sometimes making that first move seems easier than jumping out of an air plane.
"Sometimes, the first step is the hardest, but you don't have to do it alone."
"Sometimes, you might even have to make ALL the first moves."
Sorry we have to add this one.
"Speaking of his cellphone, does he turn the ringer off when he's with you or does he ignore his phone ringing sometimes?"
"Specifically, it means take care of anything that could embarrass you later."
Stare him down using your cute look or even a predator look.
Stop thinking about how you look.
Stop waiting for a man to define you!
Stop worrying about how you're blowing it or how embarrassing you are acting.
Studies have shown that most ex-boyfriend stalkers were always dealing with jealousy.
"Sure he could be hiding all the pornography he's looking at, but you know his email address."
"Sure there might be all kinds of circumstances that prevent both of them from actually going into the sexual side of this relationship, but what is really happening here?"
Tell him what you want and impress him with your knowledge!
That is a great give away on how to spot a cheater.
"That is usually a response to someone telling him, I love you."
"That might be a little extreme, but when a guy laughs about the things he's obsessed over (that you hate) or all the stuff he hates (that you adore), he's probably not actually joking."
That takes a little pressure off the situation.
"That's a perfectly fine way to feel about it, but a good question is what are you doing to keep your man and keep him happy?"
"That's an entirely different problem altogether (if you consider it one), but you can agree that it's a lot better than actually cheating on you."
"That's not to say that all flirty guys cheat, but they are way ahead of their peers in the ability to go for it."
The best advice on dealing with jealousy: stop it from the very beginning.
The best way to protect your relationships from cheaters is to do everything you can to make him happy.
"The better you know yourself, the easier this step is."
"The book 1000 Questions for Lovers by the legendary most romantic man alive, Michael Webb, not only gives you the right questions to consider, it also helps you by really getting him to open up."
"The book How to Catch a Cheats not only invaluable for really helping you get into the mind of a cheater, it also helps you to really be on the look out for the little signs that we all notice but tell ourselves they're meaningless."
"The book, Should You Stay or Should You Go will point you in the right direction."
"The book, The REAL Secrets of Sex is a great place to start."
"The description of the man above, that could be you."
The fact remains that he is getting really close with another person that he could start an all-in affair with.
The final (and not so great) thing that could happen is that he makes a smarmy comment about you staring at him.
The first and most important reason you are on this first date is to figure out if the guy you're with is at all interesting to you.
The first and most important step is to put him on a quest!
The first secret to first date tips is to pay attention!
"The first time he shows this kind of insecurity, dump him."
The following list are the 11 top signs that he's cheating on you.
The goal of the jealous boyfriend is to get you away from anyone who is going to tell you how controlling he is.
The important thing to take away from this is to realize that this behaviour is completely natural.
The jury is also out on what to do after an emotional affair.
The key point in how to spot a cheater is to follow your feelings about him.
The key thing to look out for when looking for signs he is into you is how much he's around.
The kind of irresistible charisma of a person who has worked hard on making their lives incredible.
"The longer you wait around trying to get a guy to ask you out, the worse your chances become."
"The moment he becomes inconsistent, either with the way he acts or thinks or treats you, you can tell right away that something going on."
The next step is to figure out what you are going to do.
The only way to do this is to realize that improving yourself is a permanent and life-long goal.
The only way to know for sure is to see if he gives you any of the signs of a cheater
The problem arises when this is actually something you're attracted to.
The problem is that it never stops with him smacking the losers who hit on you at the bar.
"The quicker you find out and the quicker you do something about it, the easier it will be to recover from this heartbreak."
"The reality is that if you have been sending signals and he does not take steps to ask you out, most likely it's because he's scared of rejection."
The same principle applies to infidelity.
The second book will take you from discovery of the signs of infidelity to action.
The second step is to COMMUNICATE.
The signs of infidelity are pretty easy to spot if you know what to look for.
The signs of infidelity are right there in your face.
The smell of sex gets transferred into his underwear even if he was using a condom.
The smell of sex gets transferred into his underwear even if he was using a condom.
The trick here is to do it in a semi-intimate situation.
The truth about people is that they will usually comply if they are told something with enough authority.
The whole concept of cheating is rooted in the notion of possession: He is mine and I don't want to share.
"Then again, some guys don't answer their phones when they are ahem engaged."
Then ask him about some kind of ideal situation like best holiday or favourite things to do on weekends.
Then there are the guys who get a little too close and try a little too hard around other women.
Then you'll find him on the road to an emotional affair to get what he doesn't from you.
There are men in this world who are exceedingly charming.
"There are thousands of different ways that two people can't connect and especially in long-term relationships, this is exactly what we find ourselves craving."
"There are two books that will help you through these difficult times, the first one will help you figure out if your discoveries are actually true."
There are websites like AshleyMadison that are all about having an affair.
"There is a great book, Bust Liars, That goes through all the things' hell probably do when he's lying to you."
There is a lot of subtle persuasion that goes into getting a guy to make the first move.
There is an excellent resource you need to really get a handle on where YOU ARE emotionally.
There is no better way than Rousing the Lion!
"There is something that feels like home in these people, like finding someone who reminds him of his mother (or other female figures from his past)."
There weren't too many women savages to choose from.
There will be times when he will try to act jealous again and you must stop him in his tracks Immediately!
There's nothing else you can do now that he's sitting there in front of you.
There's nothing you can do about it right now.
There's that missing piece of the connection that will never fully meet.
These are all things you need to consider or you run the risk of being miserable in a shaky relationship for a very long time.
These are the guys you need to watch out for.
"These days, it's a snap to get on-line a have an internet affair."
They are entertaining and comfortable in any situation.
They are getting exactly what they need elsewhere so sex with you becomes unnecessary.
They are given almost everything they want.
They get angry easily and they watch over you intently.
They make up for it by getting you something nice.
They want a submissive woman.
"They'll tell you every negative thing about themselves, but deliver it jokingly."
Things get predictable and boring.
"Things like shaving your legs (or whatever), wearing your sexy undies, make-up, etc."
"Think about it as the whole you approach It's a whole new way of thinking that will put you in the mindset to being so awesome, so committed to being the lover, so into your man that he wont even consider another emotional affair."
Think about that for a second Thing will only get worse when your boyfriend is jealous and dangerous.
"This all seems like overkill, but if you always made the best impression for all your first dates, your entire life might get way more organized."
This also includes if he dated anyone who was married or in a relationship.
This book is some powerful stuff that every woman needs to protect herself and her relationship.
This can be anywhere where there's not a zillion people all watching you.
This doesn't (or doesn't yet) involve sex or physical contact.
This first date tip is simply: don't worry about it.
This indicates his effort to impress you.
This is a general trait that most cheaters share.
This is a giant red flag for the signs of infidelity.
This is as low pressure as it gets.
This is one of the most important (and easiest to ignore) first date tips.
This is one of the most important signs of infidelity he can give you.
This is something you must understand now that will take your whole life to accomplish.
This is where people get into bigger trouble than they were trying to avoid.
This is why the emotional affair happened in the first place.
This is why we can't say enough about getting unstoppable confidence.
"This might feel like its way too forward for you, but it works perfectly on any guy."
"This one is so obvious, but we all seem to get caught by it every single time."
"This one is the least tangible of the signs of infidelity, but something wrong."
This program teaches you to think about love and turn your man back into a warrior.
This section is how to guide to make yourself irresistible to men.
This stuff needs to be heard in order to strengthen the relationship.
Those gifts might just be payment to you for destroying your trust.
"To him, it seems completely harmless as long as no sex happens."
Try to work your way into his world by asking him questions about whatever he finds interesting.
"Trying to decode guy into English can be difficult sometimes, especially it you have one of those silent types on your hands."
"Unfortunately, everything to some guys like this is a conquest."
"Unfortunately, most people consider sex to be end-all definition of infidelity."
"Usually in couples, one of you will discuss the desire to start getting back in shape."
"We all use this at the beginning of every relationship so we feel that we've been honest about our shortcomings and when we go crazy later, they've been warned."
We are not too far off from our furry ancestors who lived in small tribes.
We are only looking for differences here.
We can't say enough amazing things about it.
"We don't want you to look like a maniac, so practice it in the mirror (and no, it's not ANY look that involves you making a kiss face: that never looks good on anyone)."
"We found it great because not only does it help you find out for sure if he's cheating, but it also helps you understand when your relationship is failing."
"We've already touched on this a little already, but the last step is to be the best wife/girlfriend/lover you can be."
We've given you a lot of information about what to do after an emotional affair right here.
Weigh the pros and cons about your man and find out if she's worth saving.
Were going to makeover your entire life into something even a man would be jealous of.
Were not just talking about being born the beautiful daughter of two famous supermodel parents.
"Were not saying you can't take him back, but you can not take him back until its clear to you that he has learned his lesson."
What are some signs that he is into you?
What are the first date tips to getting him to show who he really is?
What does a split or a divorce mean to you and your plans for the future?
"What I'm talking about is cleaning out your car, cleaning up your house (especially your bedroom), stocking the fridge with a variety of drinks, doing your dishes, all the way to fixing that problem with your car."
"What if he's the type of guy who wont listen or worse, gets angry when people tell him what to do?"
What if his car breaks down or he gets a little tipsy and needs to come up to your place?
What if its you with the problem?
What if there was never that much sex to begin with?
What will you do when you discover the signs of infidelity?
"What, exactly does that mean?"
What's a girl to do?
What's keeping you from being that person?
"Whatever he mentions something he's about to do, make it an opportunity for him to say yes."
"When a guy feels this way, he always expresses it as anger, but he can also show it as violence."
"When a guy made his move, everyone knew about it."
"When dating someone way smarter than you, there will always be aspects of communication that you just wont get."
"When his sexual urges take a serious and unexpected upturn, its time to start asking, Is my man cheating?"
"When I confronted him, he admitted to several meetings with this other woman and phone conversations."
"When it comes to finding out if your man is cheating, you must ask yourself if he's giving you reason to be suspicious or are you just a jealous person?"
"When it comes to the purpose of first dates and first date tips, there are several things at play here."
"When it happens in a long distance relationship, it might just destroy it."
"When learning how to spot a cheater, there are many factors to consider."
"When looking for signs he is into you, it important to realize that if you really have the goods and the confidence and the personality, it really doesn't matter what he thinks right now, because when you really show him how awesome you are, he will find you irresistible!"
"When new clothing starts to show up in the wardrobe that seems unlike him or more stylish than usual, he might have infidelity on his mind."
"When passionate or happy kisses are replaced with the kind of kisses you'd give to the creepier of your relatives, (even if he's not cheating) these are a serious indication that something wrong in the relationship."
"When some men cheat, they start to lose all interest in you."
"When you can make a guy feel useful because of his extensive knowledge of everything, it will spark some of those same happy feelings towards you."
"When you get jealous, how does it make you feel?"
"When you look at it, the people who know how to be attractive get everything they've always wanted in life."
"When you spend this perfect first date worried about all the things you forgot, you might miss out on some key details."
"When you start wondering, Is my man cheating, its time to ask yourself if something has changed."
"When you truly listen to the things he needs behind what he is saying, then you know what you can do to keep him."
"When you understand that you're awesome without needing some dork in a bar to tell you so, this is true esteem and its irresistible!"
"When your man comes home form work, they smell like they always do: the normal smell of a body that's been in his clothes all day long (or food if he's in the food industry, etc.)."
"Whether you decide to stay with him or not, you will always find yourself in the same situations if you don't do something about it!"
Why do most potties also have so many other great characteristics?
Why is he wanting me more than he ever has before?
Why would he have condoms?
"Years later when you are driven mad by his poisonous spider collection, he might actually throw it back in your face that he told you on your first date about this creepy obsession."
"Yes, you definitely have a connection with him, the issue is when he is seeking a personality trait that you don't have."
You accomplish this by discussing a topic she's very comfortable with as your cornerstone.
You are fortunate you were born with a better sense of smell than a man.
You are going to be so proud of what you've accomplished?
"You are so adorable how you saved those puppies from a burning building More realistically, you can say something like, I love it when you stick your tongue out when you're concentrating."
"You both laugh, but you almost always find out he wasn't trying to be funny."
"You can be devastated that he says he's not sexually attracted to you any more, OR you can be energized that its something so easy and commit to doing something about it!"
"You can choose to be crushed if he tells you that he got into an emotional affair with this other woman because she was so smart and well-traveled, OR you can advance your career with a College Degree."
