"A good rule of thumb is that if you just said something strange or he's got a funny look on his face, stop talking, ask him something about his childhood and let him tell you about his life."
A guy who's once again willing to fight for you.
A man who is always in search of danger or new experiences might not have a problem with infidelity since it feeds into his quest for the forbidden.
A new-found interest in his looks again might indicate he has someone else to look good for.
A sort of payment for your unknowing silence.
"After getting dumped, they took on the if I can't have her, no one can mentality."
All of a sudden he has been acting as if I am miserable to him.
All of these add up to something being wrong and you need to figure out where to go from here.
"Although some of these qualities are just guidelines, there is nothing more powerful than your own intuition."
"Although this might be a welcome breath of fresh air that he's floating around like a wood nymph, he could actually be acting this way because he's getting his freak on with his secretary."
"Although your genes make you crave fascinating people, they don't give you the blueprint on how to be attractive."
"An adventure seeker is a great thing to look for in a boyfriend, it's also a way to spot a cheater if only a potential one."
An excessive phone bill usually indicates long conversations with the same person.
"And as long as you have him coming back for more, you have a great chance at landing this guy!"
"And if he got shot down, he lost his chance (often permanently) to further his genes."
Anyone can tell you this if they have ever dated someone way too smart or way too stupid for them.
Anything short of making him take an anger management course all spells out an ending whether its by you leaving or by you getting a restraining order or worse!
Anything that you might be able to get in trouble?
Are we saying you're weak?
Are you being perceptive or are you just being paranoid?
Are you really so much of a child?
Are you truly ready for him?
"As a relationship progresses, people tend to get more comfortable and stop dressing as nice as they used to."
"As we said, guilt makes a man do strange and unpredictable things."
"As your love turned to comfort, he gradually lost interest in his looks and renewed his love for Doris and beer."
Be afraid especially if he usually takes you along and now you are no longer invited.
Be ready for whatever answers he might give and decide what this means to the future of your relationship.
Be warned: he might say some things that might really hurt you if you don't pay attention to what he really wants.
Because a majority of men are afraid to get rejected.
Becoming the diva doesn't happen over night.
"Before we figure our if this cute, but tastefully shy guy will ask you out on a first date, we must first see whether he is interested in you."
"Before you even consider if he's cheating on you, he might start buying you gift or giving you extra attention."
"Before you get to upset of that statement or defend yourself with, We have an EMOTIONAL connection!, consider that there are all kinds of emotional connections you can have with someone."
"Before you get too deep into your sleuthing, stop and consider what the consequences are if you start snooping and its not true."
Being charismatic is something you have to learn.
Being cheated on makes you look pathetic.
"Besides, dating guys who never show any indication of interest usually aren't good at showing affection either."
Bust Liars tells you all the ways he's going to deflect the are you cheating on me question.
"But as long as you stay flirty and fun and not try to be completely over the top in his face, he will start to notice and he will work up the courage."
"But even then, you still might have a chance."
"But no matter what your heart tells you, there are tons of ways to get yourself out of these situations."
"But once you're there, drop it."
"By that time, you might already be in love with a guy who doesn't deserve you."
Can you ever trust him again?
Can you get back to trusting him?
Can you save the relationship?
Can you save your relationship?
Cheaters have cheating on their minds.
Cheaters will always put things in the terms of their own experiences.
Check out the book How to be Irresistible to Men to see if you are doing everything you can to ensure that his eyes are only on you.
Check out this great article on how to lie to see into the mind of a liar.
Check out this great article on how to lie to see into the mind of a liar.
Compliments are great for this.
"Condoms, phone calls where someone hangs up, lipstick smears, perfume, an extra set of clothes in his car, receipts, large phone bills, not answering his phone, his phone being dead all the time These are all indications that he could be having an affair."
Dating guys with the emotional range of a carrot makes for a painfully boring relationship anyway
Dealing with jealousy starts with how you feel about the men in your life.
Did he really do something that bad?
"Did you figure it out on your own, or did he tell you about the thing that impressed you?"
Discover who his heroes are.
"Discover your own happiness and I promise, when that amazing man finally comes along, you'll not only have to skills to catch him, you'll also know you to keep him in your life."
Do you always seem to attract jealous guys?
Do you really want to be the person your boyfriends have to fear?
Do you two even use condoms any more?
Does he freak out when you walk into the room and immediately switch what he's doing on the computer?
Does he get on the computer after you have gone to bed or stay on it much longer than normal?
Does he get wrong number calls or not answer his cellphone sometimes?
Does he leave the room to take some conversations?
Does his job really require him to leave town for a weekend?
Does his job really require him to leave town for a weekend?
Don't date a guy with jealousy problems.
"Don't get me wrong, I'm a big fan of gifts for no reason and this shouldn't be a reason to question the appearance of great gifts, but if this is just one of the many signs of infidelity, than its best you don't throw away the box it came in just in case"
Don't let this first date tip slip by you.
Don't let this get you down and realize it's not your fault!
Don't make any decisions about this emotional affair that you will regret later without knowing EXACTLY how you will feel about it in the future.
Don't think that you can do all of this in a day or even a month.
"Either way, you want to know and you want to know NOW."
Emotional cheating happens when someone in a relationship gets involved with someone else on a deep emotional level.
"Even cute, stylish, rich guys can be pathetically uninteresting."
Even great liars have trouble hiding their tracks.
"Even if it goes completely against logic, moral codes, or possible reality, we all like to think that this might be that one perfect date with a perfect guy."
"Even if it's something very small, but has affected you all the same, just pay attention to how you get your information."
"Even if that's too racy for you, how about that final peck on the cheek is met with your garlic breath and body door since you forgot to buy deodorant and didn't bring gum?"
"Even if they don't have a very impressive game, eventually someone will say yes to his advances and now he's cheating on you."
"Even if you totally love this guy, dump him."
Even then it doesn't stop there.
"Even when it backfires, it will let you know without a doubt whether he's into you or not."
Every day should be a new commitment on another aspect of how to be attractive.
Fear of rejection paralyses so many people in this world.
Find out what he values most.
Find out why you feel this way and figure out how to avoid it before it breaks up the best relationship you've ever had.
First get yourself hooked up with some cheap to free financial aid and then choose a degree program in a growing career and show him you can be the smarty knickers he's got the hots for!
"For a guy who doesn't have all of his cards on the table, you need to decode a little deeper."
"For an explanation of this, check out eye contact flirting to learn how to say everything with your eyes."
"For example, if he's an avid golfer you can ask what happens if he can't find his ball."
"For now, its imperative you check out Should You Stay or Should You Go to really examine what actions you need to take now that you've discovered the signs of infidelity."
"For now, you need to figure out how you feel about your husband, yourself, and the emotional affair."
"Fortunately, jealous guys are relatively easy to spot."
Get into your first date and be present.
Get out of your head and into his.
"Girl, this is a bad situation."
"Girl, you gotta kill it now so it does not ruin your relationship all of your relationships."
Give him a chance to show you his talents by forcing him to show you.
Give it to him!
Go with your raw feeling and don't try to add any convincing in with it.
Got any first date tips that can help a girl figure a little more out about the guy sitting across from me?
"Granted, some women use smelly lotions and perfumes and all he has to do is give a handshake for the smell to transfer, but if you keep smelling the same smells over and over again, he is coming in close contact with the same woman."
Guilt can do a number on someone's conscious.
Guilt is a very strong emotion and he might be avoiding contact with you because he is cheating on you.
Guys like this tend to be controlling and are seeking women they can boss around.
Has he now password protected his laptop or some part of his computer?
Has this guy done anything special to catch your eye?
"Have you ever sat down and asked all the silly, interesting, and deep questions that you've always wanted to know?"
Having a guy who likes you wont make any difference if you don't have the skills to seal the deal.
Having a jealous boyfriend is as much your fault as it is his.
He becomes secretive and starts doing things out of character.
He can't possibly stray to another emotional (or sexual) affair if you are irresistibly attractive on many levels.
He could give you sexually transmitted disease.
He could have children with the woman (or women) he's sleeping with.
"He could worship the ground you walk on, but feel powerless to ask you out for a number very important but meaningless reasons."
He did not think about logistics or which cologne to wear or who pays what.
"He doesn't care that you see him in his ugly underwear because you love him, but he does car that the other girl might think he's a pig."
He got caught and feels like an ass which is why he is so much more affectionate with you than he was before.
He got into emotional infidelity because there are things he felt he just couldn't connect with you on.
He had been calling the same number for four months.
He has either opened up his mind to the possibility that you are engaged in the same acts as him or he's just accusing you to throw you off his trail.
He is desperate to communicate!
He is searching for an emotional connection with someone else that he doesn't have with you.
"He may even be rich, but if he's boring and stupid, get ready for a lifetime of boring and stupid"
He might all of a sudden start smelling like different soap or freshly showered when he comes home.
He might even be acting happier and animated.
He might even handle the phone bill on his own now to keep you from seeing it.
He might even start experimenting in the bedroom.
He might even take up a new interest in fitness that he never had before.
"He might give you no clue when he makes his comment, in that case, it's probably best to simply assume he's not showing signs he is into you."
He might just be a very confident guy.
He might not actually even be cheating and only be depressed about something.
"He might try to invite himself along, but if he's one of the more clueless fells out there, tell him he needs to come along."
He might want to beat up your boss or your male cousin.
He needs to know that you are nice and this lowers his chances of being embarrassed.
He wants back in your heart.
He wants to make things right and turning ultra-sexual is his best idea.
He was actually warning you that he has a third arm growing out of his back.
He wont let you do that any more.
He's acting removed or secretive.
He's acting weird and its making you suspicious.
He's desperate to please you and to have you forgive him for his emotional affair.
"He's having so much fun and learning new things about his sexuality, he just can't keep his hands off you too."
He's like the tiger who's tasted human flesh
He's totally worried about how he's doing too.
Here how it works: you two talk about anything and he mentions anything he's about to do.
Hoping for a guy to come along and save you be not part of how to be attractive.
How can you get past his caveman fear of rejection quickly?
How could him cheating on me not be the worst thing to have happened?
How good is he at answering his phone?
How much do you really know about each other?
"However, if you know how to look, guys aren't so difficult to figure out."
"However, you need to do this to deal with his jealousy and make your point clear."
I checked up on him because it was happening to a girlfriend and it made me wonder.
I had no idea he was cheating because he did not follow any of the normal signs of cheating.
"I know, that seems like less of an infraction, but it shows that he might not put a high value on other peoples feelings."
I seem to always blow it on first dates.
"I'm not saying that people don't and can't change, but if your love is showing all these signs of infidelity, its likely he's been doing it for a long time."
"If a guy is really into you, he will make it a point to be seen as much as he possibly can even to the point of maybe being a little creepy."
"If all of a sudden he has a gym membership and never discussed it with you, start feeling concerned for your relationship."
"If communication in relationships is really important to you, then shut up."
"If everyone always told you how fabulous you are, it's no stretch to start believing it."
"If he always gets weird when he's on his computer, then he's probably just looking at pornography."
"If he comes home smelling like someone else perfume or smelling of sex, this is a dead give-away."
If he doesn't (or can't) you've just saved yourself an eternity of miserable awkward silence.
"If he even likes you a little, he will totally say yes."
"If he ever admits to cheating before, take it as a get out of jail free card."
"If he has no't been to the gym, why would he have taken a shower at night?"
"If he is consistently smelling different, he might be having an affair."
"If he left a girlfriend or wife to be with you, you can make a pretty safe bet that the same thing is going to happen to you."
"If he looks away first and then looks right back at you, you are probably dealing with a shy guy who is definitely showing signs he is into you!"
"If he mentions playing an instrument or mentioning something he's proud of, tell him you'd really like to see him do exactly what he just described."
"If he says it in a funny way while smiling, the are in!"
"If he says it in a mean way or insults you loud enough for others to hear, then he might actually just be a jerk."
"If he seems shady or dangerous to your heart, there is an overwhelming chance that he probably is going to be a cheater."
"If he shows any signs of using violence to settle his problems, jealousy is usually not far behind."
"If he smells like a fresh shower, something up."
"If he stares you down until you look away, it's a little more difficult to decipher."
"If he starts suggesting or attempting sexual acts that seem above your skill level or just a little too kinky, he might be learning new things from someone else."
"If he starts to change his behaviour including becoming cold or even super-loving, something has definitely happened in his life to make that change."
"If he's accusing you of cheating on him, especially if its out of the blue and for no apparent reason, then he knows something"
"If he's always flirting with other women and it throws you into a rage, stop putting yourself in these positions."
"If he's always picking up on the first ring, but some nights he does not answer at all"
"If he's always stepped out to take conversations and always get wrong numbers, then don't worry about it."
"If he's doing it in front of you, then he's usually ten times worse when he does not have someone watching over him."
"If he's got a different email address, it might be used to hide something secret."
"If he's not cheating now, hell definitely be thinking about it."
"If he's not getting any, you can bet his mind is racing."
"If he's not touching you at all or he's breaking out moves that are way beyond his previous interests in sex, then he's showing one of the most classic signs of infidelity."
"If he's now hitting the gym with the Igor of Conan the Barbarian, he's got influential reasons to do so"
"If he's rich, but he hates his 80 hour a week job, he's bound to be permanently miserable."
"If he's showing all the signs of an affair and its that obvious, Its likely to mean that he's been doing it for a long time and has got careless in covering up his tell-tale signs of infidelity."
"If he's way too stupid, you find yourself dumbing down what you talk about just to engage him."
"If his city whites with the holes in the crotch get replaced with some leopard print banana hammocks, and he's the one who bought them, you can bet he's starting to care who sees him in his undies."
"If not, this is a 10 on the Is my man cheating on me scale."
"If that guy gets any underwear, you're usually the one getting it for him."
"If they are always tending to their needs, the bond he may share with you might not mean so much if he gets the right kind of temptation."
"If this one doesn't work, you have another easy option."
"If those tell-tale white smudges occur in his underwear on days that you know for sure that you didn't sleep together, then he's showing you his signs of infidelity without saying a word."
"If you actually just met the man of your dreams and you're kicking yourself for not cleaning up your house, forget it."
"If you are confused about where to go from here in any way, this book helps give you clarity on how to move forward in a smart way that is best for you."
"If you are the kind of girl with unstoppable confidence, you'll never get another guy like this in your life again!"
"If you ask 100 people whether an emotional affair is as bad as a sexual affair, you will hear 100 different answers."
"If you can reach him with your sexuality, he will NEVER stray again."
"If you can spot anything she's doing to draw attention to himself, you can bet this is one of the sure signs he is into you."
"If you come across a new email address, odds are, he's got it for other activities."
"If you do take this emotional man back, you have to make it clear that you will not tolerate his jealous behaviour and that is the only condition on which you will let him back in your life."
"If you follow these first date tips, you will come away from your first date with just about everything you need to decide whether you'd be interested in a second date."
"If you give him something to fight for, he will prove himself and he will prove she's sorry for his emotional affair."
"If you have a self-serving guy, you might also have a cheater on your hands."
"If you have issues dealing with jealousy, go get counselling and definitely check out the confidence building audio course."
"If you know he's got a hobby or a sport or a pastime that he puts a lot of time into, you can read up about it and ask him a question about it the next time you see him."
"If you really have a serious problem dealing with jealousy, then don't date player men."
"If you really have to know, buy him some new underwear and make sure its black."
"If you think something is up, then there's a really good chance that you are right."
"If you want a guy fighting for your honour all the time, then date a jealous guy."
"If you're already involved and need to figure out your options, its best that you read a lot more on this subject."
"If you're not learning new stuff, finding new interests, discovering more about each other, working on being healthy, and reinventing yourself, your relationship (and all further relationships) is doomed to the same fate."
"If you're really freaked out, this is the last place you should look."
"If you're really freaked out, this is the last place you should look."
"If you've actually considered doing something like hiring a private eye, do yourself a favour and get this information first to see if its even necessary."
"If you've caught your man in an emotional affair, here are some things you need to consider:"
"If you've ever cheated on someone and got away with it, you know how empowering it feels."
"If your man is jealous, FORCE HIM to read this book!"
If your man never puts himself in the position to have an opportunity to cheater
"In fact, he might not be much of a talker at all."
"In relationships where both people are very masculine or feminine in their interactions, they sometimes crave someone who is their girlfriends or wives opposite."
"In relationships where two people are of vastly different ages, both seek to talk to someone who shared their generational issues."
"In the end, what he drives or what he does for work isn't as important as how he feels about his life."
"In the process, your man rediscovers how really awesome you are."
Inconsistency is the best way to spot a cheater.
"Infidelity is often a result of much bigger problems, but it forces you to ask yourself if the relationship is going anywhere and if its worth saving whether cheating has crept in."
Is an emotional affair really that big of a deal?
Is he erasing his web browsing history or doing things on the computer to cover his tracks?
Is he starting to end phone calls with me too?
Is my man cheating on me?
Is the relationship worth saving?
Is this a moment of weakness or is he a serial cheater?
It all starts with asking yourself the really tough questions: how much do you really love this guy?
It all starts with the definition of attraction.
It does not accomplish anything and it shows how insecure someone is.
It drives a wedge down the middle of your relationship and prevents you from gaining total trust and love from your man.
It goes through all the things you should be considering right now.
It happens to calmest among us.
It means that you should try to take care of every variable before you arrive at the first date all adorable.
"It might not be the best idea for you, but he's trying to commit and this is the way he thinks he can win you back."
"It might seem cool that you have a manly man that can protect you, but unless you live in a dangerous part of the world, needing a guy who is readily willing to fight is an outdated idea."
It's a downloadable book that you can get right away and start putting into action tonight.
It's all in how he says whatever he says.
"It's OK to like the bad boys, but just keep in mind how hurt you'll be if he actually cheats on you."
"Its all the attention that brings them unstoppable confidence (it also gives them an irrational insecurity, but that's another story)."
Its important to follow your heart and never convince yourself that he is better than what he appears to be.
Its just a seemingly harmless chance to get to know each other better.
Its like you've been told your whole life that eating ice cream will kill you.
"Its pretty cool to get those just because gifts, but is this not really part of his personality."
Its so easy to look at this huge list of required reading and decide its just not worth it.
Its time to have an Honesty Session where both of you get to say exactly what you are feeling.
Its time to really give him a chance to make things right for you.
Its time to really investigate how you really feel right now?
Jealous boyfriends are emotional guys.
Jealous guys always fall for a certain type of woman: one that he can hold power over.
Jealousy is a terrible emotion that makes people do terrible things.
Jealousy is one of those gateway emotions.
Jokes are not always funny.
Just imagine yourself a year from now looking back to these moments and seeing how far you've come and how much you've grown.
"Keep in mind, some people just act this way."
Keep on the lookout for any selfish behaviour early in the relationship.
Keep your man on his toes.
Keeping your man (and keeping him in love) is a daily process.
"Let's face it, if someone is always deleting their history and covering their tracks on their computer, you can guaranty they are not hiding their Hello Kitty fixation."
"Let's face it, most people in this world are very predictable."
Make him feel understood and he'll have no choice but ask you out on a date.
Make sure there are at least a few of the Is my man cheating signs out there before you make any accusations.
Making excuses like its not normally this messy makes you look like a lying slob. What if your well-deserved and super-sexy make out session involves him running his hand down your sandpaper thighs?
"Many women think that those lulls in conversation are horrible, but consider this very important first date tip: men don't chat like you might."
"Maybe he answers his phone, but talks in a whisper."
